{
  "$schema": "https://json-schema.org/draft/2020-12/schema",
  "type": "object",
  "properties": {
    "$schema": {
      "type": "string"
    },
    "name": {
      "type": "string",
      "pattern": "^[a-z][a-z0-9-]*$",
      "description": "Unique kebab-case identifier."
    },
    "version": {
      "type": "string",
      "pattern": "^\\d+\\.\\d+\\.\\d+$"
    },
    "title": {
      "type": "string",
      "minLength": 1
    },
    "description": {
      "type": "string",
      "minLength": 1,
      "maxLength": 200
    },
    "group": {
      "type": "string",
      "minLength": 1
    },
    "ui": {
      "default": [],
      "type": "array",
      "items": {
        "type": "string",
        "pattern": "^[a-z][a-z0-9-]*$",
        "description": "Unique kebab-case identifier."
      }
    },
    "sections": {
      "default": [],
      "type": "array",
      "items": {
        "type": "string",
        "pattern": "^[a-z][a-z0-9-]*$",
        "description": "Unique kebab-case identifier."
      }
    },
    "files": {
      "minItems": 1,
      "type": "array",
      "items": {
        "anyOf": [
          {
            "type": "string",
            "minLength": 1
          },
          {
            "type": "object",
            "properties": {
              "from": {
                "type": "string",
                "minLength": 1
              },
              "to": {
                "type": "string",
                "minLength": 1
              }
            },
            "required": ["from", "to"]
          }
        ]
      }
    },
    "dependencies": {
      "default": {},
      "type": "object",
      "propertyNames": {
        "type": "string"
      },
      "additionalProperties": {
        "type": "string"
      }
    }
  },
  "required": ["name", "version", "title", "description", "group", "files"]
}
